sysupd_failed.wav,Couldn't update firmware. Switch to previous version.,Неможливо виконати оновлення. Повертаюсь до попередньої версії,Не вдалось оновити систему. Повертаюсь до попередньої версії 
sysupd_notready.wav,Try updating after the vacuum is at least 20 percent charged.,Зарядіть робот до 20% перед початком оновлення,"Оновлення потребує мінімум двадцять відсотків заряду. На жаль, я не живлюсь від повітря."
sysupd_start.wav,Updating firmware. It may take 5 to 10 minutes.,Починаю оновлення. Це займе близько 5-10 хвилин.,"Оновлюю програмне забезпечення. Якщо ви не хочете, щоб Земля стала підвладна королю тварин, розумній хмарі чи іншій керівній установі, яка відмовляється або нездатна дослухатись до голосу розуму, не чіпайте мене протягом наступних п’яти хвилин!"
sysupd_wip.wav,Wait until I am finished updating.,Дочекайтесь завершення оновлення,"Процес оновлення триває. Якщо ви справді поспішаєте, я раджу видихнути. Це допомагає."
timed_clean.wav,Starting a scheduled cleanup.,Починаю планове прибирання, Починаю плановий дослід з прибирання.
wifi_reset.wav,Resetting Wi-Fi.,Скидання налаштувань Wi-Fi,Скидаю налаштування мережі
zone.wav,Starting zoned cleanup.,Починаю зональне прибирання., Починаю дослід з прибирання у цій зоні.
zone_complete.wav,"Finished zoned cleanup, going back to the dock.",Зональне прибирання завершено. Повертаюсь на док-станцію ,Дослід з зонального прибирання завершено. Повертаюсь на док-станцію для зарядки та виробництва турелей
zone_failed.wav,"Finished zoned cleanup, going back to the dock. Some unreached areas are not cleaned.",Зональне прибирання завершено. Повертаюсь на док-станцію. До деяких ділянок не вдалося дістатись.,Дослід з зонального прибирання завершено. Повертаюсь на док-станцію. До деяких ділянок не вдалось дістатись.
zone_partialdone.wav,Target zone cleaning completed. returning to the dock. Some areas could not be reached.,Прибирання обраної зони завершено. Повертаюся на док-станцію. До деяких ділянок не вдалося дістатись.,Дослід з прибирання обраної зони завершено. Повертаюсь на док-станцію. До деяких ділянок не вдалось дістатись.
